<?xml version="1.0" encoding="utf-8"?>
<library xmlns="http://example.org/jk/library"
 xmlns:xsi="http://www.w3.org/2001/XMLSchema-instance"
 xsi:schemaLocation="http://example.org/jk/library library.xsd"
>
  <book language="EN">
    <title>Bookone</title>
    <year>2000</year>
    <author ref="au1"/>
  </book>
  <book language="PL">
    <title>Booktwo</title>
    <year>1900</year>
    <author ref="au2"/>
  </book>
  <book language="CN">
    <title>Bookthree</title>
    <year>1800</year>
    <author ref="au3"/>
  </book>
  <author id="au1">
    <name>Jack</name>
  </author>
  <author id="au2">
    <name>Pitor</name>
  </author>
  <author id="au3">
    <name>Polo</name>
  </author>
</library>